{
  "run_id": "",
  "feature": "",
  "branch": "",
  "ticket": "",
  "created_at": "",
  "workflow_profile": "web-product",
  "phase": "plan",
  "phase_status": "pending",
  "plan_mode": "required",
  "plan_file": "",
  "route_after_plan": "",
  "skipped_phases": [],
  "qa_requires": ["build"],
  "qa_next": "devops",
  "qa_handoff": "qa-to-devops.md",
  "completed_phases": [],
  "gates": {
    "push": "pending_user",
    "pr": "pending_user",
    "deploy": "pending_user"
  },
  "agents": {
    "current": "sage-orchestrator",
    "next_command": "sage-plan"
  }
}
